{"campaign":{"acceptance":{"bytes":4363,"path":"acceptance-result.json","sha256":"c6fc6bbeaea5a59bc34b05a2d8c3bef84ec53719848e89668afee11ba9f8a4a9"},"candidate_id":"c01650-candidate-r1","id":"c01650-formal-vc1-r1-20261029t000000z"},"completed_at_utc":"2026-10-29T19:10:54Z","final_state":{"active_version":"0.165.0","candidate_id":"c01650-candidate-r1","container_status":"running","health":"pass","image_id":"sha256:6c732406ea171ce0cabef4437f47978dd9b58cdad71f85617cd7b2340d5071f7","profile_digest":"26d4c2cee46327320feae65786e480e5b6d5fe1aecd332e1c753f9a604df3681","profile_id":"codex-0.165.0-official-r1650-r1"},"post_promotion_gate":{"bytes":12714,"path":"post-promotion-gates.receipt.json","sha256":"4a710506e750966e002ec3b3f08a37189f42f6ffa3400d0402ee942fd8dffc8f"},"producer":{"facts":{"bytes":10455,"path":"activation-facts.json","sha256":"35bd07fe28226939c7d60223fdce5176cc9f514b149a3a58646f768522f6af8e"},"schema_version":"codex-production-activation-producer/v2","tool":"/root/docker/capture-cli/data/tools/official_client_capture/production_activation_receipt.py","tool_sha256":"ef971f5a7163fdf7d7b1b6b87c9af923cb9c0b66da9250a3f87aaa891c410a22"},"promotion":{"bytes":2637,"path":"catalog-promotion-receipt.json","sha256":"a19ad85fa50d10e467c8132e04624e90ac86833f1f0a99d2e2702c1814a66019"},"rollback":{"build_id":"ghcr-itv3-sub2apiplus-0.2.18-2","deployed_version":"0.164.0","image_id":"sha256:ab9f9b5568f7bb5dbcd2e1944662e15ecbd470e0d5cb37d479c6a39e819907f8","image_reference":"ghcr.io/itv3/sub2apiplus@sha256:ab9f9b5568f7bb5dbcd2e1944662e15ecbd470e0d5cb37d479c6a39e819907f8","profile_digest":"871526df931ac6c0330886fef1a25ac98db1ac3e2cf4cf849828c296a0df3d9d","profile_id":"codex-0.164.0-official-r1640-r1","source_tree_sha256":"b84fdf4e0161494195d1835241ba51aec08846ba9ded711f09b78df97ec6504b","version":"0.164.0"},"schema_version":"codex-production-activation-receipt/v2","stages":[{"architecture":"linux/arm64","checks":{"active_version":"0.165.0","container_status":"running","fatal_log_count":0,"guard_failure_count":0,"health":"pass","profile_digest":"26d4c2cee46327320feae65786e480e5b6d5fe1aecd332e1c753f9a604df3681"},"completed_at_utc":"2026-10-29T19:10:07Z","evidence":[{"bytes":949,"path":"stages/canary/activation-fact.json","sha256":"955776d69f063a3e450930e737a71203f0ba8722609dbae01528c8d2809c937c"},{"bytes":2243,"path":"stages/canary/canary-compose.yml","sha256":"1ebc02473cb512f05bb084a7bf95ebd51d360d37205a2b0bec2aa6b98310000a"},{"bytes":12382,"path":"stages/canary/container.log","sha256":"f98707a395f96ce3fdda7d6e3d2d2b65584966fe395f518d792b8884d07e1e4e"},{"bytes":15,"path":"stages/canary/health.json","sha256":"a29ee2b15c494311c52521766e44af56a3ad2248e7a8ab465e5206463c13d288"},{"bytes":513,"path":"stages/canary/networks.json","sha256":"823ce11e26357ad0454d70264ed25da5836c91dd7bdf583b19176ecca2361168"}],"host":"22-7-28-0641","image_id":"sha256:6c732406ea171ce0cabef4437f47978dd9b58cdad71f85617cd7b2340d5071f7","name":"canary","started_at_utc":"2026-10-29T19:09:17Z","status":"pass"},{"architecture":"linux/arm64","checks":{"active_version":"0.165.0","container_status":"running","fatal_log_count":0,"guard_failure_count":0,"health":"pass","profile_digest":"26d4c2cee46327320feae65786e480e5b6d5fe1aecd332e1c753f9a604df3681"},"completed_at_utc":"2026-10-29T19:10:25Z","evidence":[{"bytes":949,"path":"stages/production_switch/activation-fact.json","sha256":"5a1ba5c18aba7a35eef2253ac969fa6997ec2235b74ad175480d45c1d34646b4"},{"bytes":31,"path":"stages/production_switch/business-curl.txt","sha256":"5c32a68e4ed02dad58fea95ac6e92fe1feab1ecfae5f2f4443195ab0ee4b32ba"},{"bytes":327,"path":"stages/production_switch/business-response.json","sha256":"7464f29e2b3b9cb3857155e2f63f7b65ce0117dc6c52949bca375fe3cdbe3510"},{"bytes":8420,"path":"stages/production_switch/container.log","sha256":"bc3da6485cde9e255412727ec618bc3a0119f9dc13c9ced814976110ad320926"},{"bytes":14690,"path":"stages/production_switch/docker-compose.before.yml","sha256":"2d74d967a396805190b31aa2890b8f8f5bdf692b89b3917f9a48e7d422cd9d2a"},{"bytes":14634,"path":"stages/production_switch/docker-compose.used.yml","sha256":"af2e31885c9a505ebbad5b5a130b09204cf59a44d5bd26b362058b39772feb9f"},{"bytes":2408,"path":"stages/production_switch/egress-status.json","sha256":"555ae59c8aac22464e911c1f17466248dc0f434e9301bc06aeb4d70be8f046ba"},{"bytes":289,"path":"stages/production_switch/mounts.json","sha256":"bc80378ddc40bd030058668f28328727a9834868a0f28947fec59f158d79098c"},{"bytes":1080,"path":"stages/production_switch/networks.json","sha256":"504de5d57572c72df044de1e5d4fa24631771ed61ba4ef2f46ee5c9e8088f4a0"},{"bytes":41,"path":"stages/production_switch/usage-rows.txt","sha256":"9eedbab2219edfaf2650120b60cc6f79df13929ad7ccbf150f7356566f67e0b9"}],"host":"22-7-28-0641","image_id":"sha256:6c732406ea171ce0cabef4437f47978dd9b58cdad71f85617cd7b2340d5071f7","name":"production_switch","started_at_utc":"2026-10-29T19:10:11Z","status":"pass"},{"architecture":"linux/arm64","checks":{"active_version":"0.164.0","container_status":"running","fatal_log_count":0,"guard_failure_count":0,"health":"pass","profile_digest":"871526df931ac6c0330886fef1a25ac98db1ac3e2cf4cf849828c296a0df3d9d"},"completed_at_utc":"2026-10-29T19:10:40Z","evidence":[{"bytes":31,"path":"stages/rollback/business-curl.txt","sha256":"b29f4827e9fd1752376e9f210b18c5d30b863bee4bdf3b5ca97f1f9b571c731b"},{"bytes":327,"path":"stages/rollback/business-response.json","sha256":"98afbc28715daab1d1608d0f81ff8da41e409bf8a51b7cb34c2d7bb7e9018b2b"},{"bytes":8420,"path":"stages/rollback/container.log","sha256":"4b9b9f59a156abce600e96125ca962870346f9eb5fff56e6985734ab82d9a415"},{"bytes":14634,"path":"stages/rollback/docker-compose.before.yml","sha256":"af2e31885c9a505ebbad5b5a130b09204cf59a44d5bd26b362058b39772feb9f"},{"bytes":13710,"path":"stages/rollback/docker-compose.used.yml","sha256":"81d9e1890fc791749419905d400c271ee6561da064ffb7f1285bd4082385711d"},{"bytes":2406,"path":"stages/rollback/egress-status.json","sha256":"9b6edec3dd6362bfcb6845de97bf1fe756d0795cb4dd3999dcd9a5cb69517052"},{"bytes":289,"path":"stages/rollback/mounts.json","sha256":"bc80378ddc40bd030058668f28328727a9834868a0f28947fec59f158d79098c"},{"bytes":1080,"path":"stages/rollback/networks.json","sha256":"e8495a53e4ca13696bb015d3d15a07fffb88d52cb12a5e222c98182a226e5200"},{"bytes":41,"path":"stages/rollback/usage-rows.txt","sha256":"99bad57426c6867063f74de4b740c570052a0d4e527e2cd5f7260fbfa1348ecc"}],"host":"22-7-28-0641","image_id":"sha256:ab9f9b5568f7bb5dbcd2e1944662e15ecbd470e0d5cb37d479c6a39e819907f8","name":"rollback","started_at_utc":"2026-10-29T19:10:25Z","status":"pass"},{"architecture":"linux/arm64","checks":{"active_version":"0.165.0","container_status":"running","fatal_log_count":0,"guard_failure_count":0,"health":"pass","profile_digest":"26d4c2cee46327320feae65786e480e5b6d5fe1aecd332e1c753f9a604df3681"},"completed_at_utc":"2026-10-29T19:10:54Z","evidence":[{"bytes":950,"path":"stages/target_restore/activation-fact.json","sha256":"9280773b78f0645f094bca031b5dc5ad4d2b5d7be4b180ee7809c467c3f60f8e"},{"bytes":31,"path":"stages/target_restore/business-curl.txt","sha256":"99e89963d1f070ae973f7613c935001cb11a2acc46b998a66e4cb929bb8b29ca"},{"bytes":327,"path":"stages/target_restore/business-response.json","sha256":"9624968addbf860351cd4376af04d9fbfed64f229d8a17bcce6a2e07ea60e07c"},{"bytes":8420,"path":"stages/target_restore/container.log","sha256":"12a8d5488c2bc94a02709a852457dbfb0ebab84c75826efcdcb763d1546c1483"},{"bytes":13710,"path":"stages/target_restore/docker-compose.before.yml","sha256":"81d9e1890fc791749419905d400c271ee6561da064ffb7f1285bd4082385711d"},{"bytes":14634,"path":"stages/target_restore/docker-compose.used.yml","sha256":"af2e31885c9a505ebbad5b5a130b09204cf59a44d5bd26b362058b39772feb9f"},{"bytes":2408,"path":"stages/target_restore/egress-status.json","sha256":"112a2a0e58049e6c8e459edc29ae8c3cbc0ff7af41af51cc79daf574f8611500"},{"bytes":289,"path":"stages/target_restore/mounts.json","sha256":"bc80378ddc40bd030058668f28328727a9834868a0f28947fec59f158d79098c"},{"bytes":1080,"path":"stages/target_restore/networks.json","sha256":"482a67a41836ee7ffbf6453efa6abe19cbe3778c171238cc9d488661162f8b3c"},{"bytes":41,"path":"stages/target_restore/usage-rows.txt","sha256":"e0c2e7fdb90ddf9abf843f7a484432e8fe679198a526793c07695e034ae94e7b"}],"host":"22-7-28-0641","image_id":"sha256:6c732406ea171ce0cabef4437f47978dd9b58cdad71f85617cd7b2340d5071f7","name":"target_restore","started_at_utc":"2026-10-29T19:10:40Z","status":"pass"}],"target":{"build_id":"c01650-production-05de4254f-20261029t190643z","deployed_version":"0.165.0","image_id":"sha256:6c732406ea171ce0cabef4437f47978dd9b58cdad71f85617cd7b2340d5071f7","image_reference":"sub2apiplus-c01650-production@sha256:6c732406ea171ce0cabef4437f47978dd9b58cdad71f85617cd7b2340d5071f7","profile_digest":"26d4c2cee46327320feae65786e480e5b6d5fe1aecd332e1c753f9a604df3681","profile_id":"codex-0.165.0-official-r1650-r1","source_tree_sha256":"76ee7bb55a1a5402a4a8530b4f502c0d97ebf62432866470b98e01e031904356","version":"0.165.0"}}
